MEDIAN EARNINGS IN THE PAST 12 MONTHS (IN 2015 INFLATION-ADJUSTED DOLLARS),Total Estimate,Total MoE,Percent Estimate,Percent MoE,Male Estimate,Male MoE,Percent Male Estimate,Percent Male MoE,Female Estimate,Female MoE,Percent Female Estimate,Percent Female MoE
Population 25 years and over with earnings,"30,185","+/-1,514",(X),(X),"36,438","+/-1,320",(X),(X),"20,802","+/-1,374",(X),(X)
Less than high school graduate,"20,787","+/-2,414",(X),(X),"21,928","+/-4,901",(X),(X),"16,981","+/-3,329",(X),(X)
High school graduate (includes equivalency),"27,896","+/-3,520",(X),(X),"35,457","+/-1,463",(X),(X),"17,700","+/-2,527",(X),(X)
Some college or associate's degree,"30,287","+/-2,410",(X),(X),"41,687","+/-3,565",(X),(X),"21,527","+/-1,392",(X),(X)
Bachelor's degree,"35,854","+/-2,757",(X),(X),"40,742","+/-8,302",(X),(X),"32,824","+/-3,531",(X),(X)
Graduate or professional degree,"53,672","+/-3,703",(X),(X),"62,468","+/-4,357",(X),(X),"47,639","+/-12,727",(X),(X)
