MEDIAN EARNINGS IN THE PAST 12 MONTHS (IN 2015 INFLATION-ADJUSTED DOLLARS),Total Estimate,Total MoE,Percent Estimate,Percent MoE,Male Estimate,Male MoE,Percent Male Estimate,Percent Male MoE,Female Estimate,Female MoE,Percent Female Estimate,Percent Female MoE
Population 25 years and over with earnings,"33,353","+/-1,150",(X),(X),"40,162","+/-1,168",(X),(X),"27,379","+/-1,052",(X),(X)
Less than high school graduate,"22,769","+/-3,654",(X),(X),"25,524","+/-2,245",(X),(X),"19,814","+/-3,060",(X),(X)
High school graduate (includes equivalency),"27,813","+/-1,603",(X),(X),"33,486","+/-3,092",(X),(X),"22,196","+/-1,582",(X),(X)
Some college or associate's degree,"32,370","+/-1,098",(X),(X),"40,136","+/-1,374",(X),(X),"26,080","+/-1,174",(X),(X)
Bachelor's degree,"41,945","+/-1,604",(X),(X),"52,339","+/-2,936",(X),(X),"35,198","+/-2,102",(X),(X)
Graduate or professional degree,"52,402","+/-2,909",(X),(X),"62,140","+/-7,265",(X),(X),"45,571","+/-3,346",(X),(X)
